{"apiVersion":"kernel-zero.dev/v1","kind":"ManifestPolicy","metadata":{"description":"Manifest license and pin rules","name":"manifest-hygiene","revision":1},"rules":[{"check":{"allowed":["MIT","Apache-2.0"],"kind":"allowed-licenses"},"id":"allowed-license","level":"error","remediation":"Use an allowed license in package.json.","title":"License must be allowed"},{"check":{"fields":["dependencies"],"kind":"pinned-dependencies"},"id":"pinned-dependencies","level":"error","remediation":"Pin dependency versions exactly.","title":"Dependencies must be pinned"}]}
